{
  "schemaVersion": 1,
  "product": "atm-harness-distribution",
  "algorithm": "sha256-atm-distribution-v1",
  "releaseVersion": "1.1.0",
  "packages": [
    {
      "name": "maintenance",
      "path": "plugins/maintenance",
      "kind": "skills"
    },
    {
      "name": "mattpocock-skills",
      "path": "plugins/mattpocock-skills",
      "kind": "skills"
    },
    {
      "name": "workflow",
      "path": "plugins/workflow",
      "kind": "skills"
    }
  ],
  "files": [
    {
      "path": ".agents/harnesses/registry.json",
      "sha256": "c7144d00ba1e11bad295fbddca54da0088b025e84d5eb1566ee21a15e7482302"
    },
    {
      "path": ".agents/harnesses/registry.schema.json",
      "sha256": "f9ea69796c96e141e427ab73c8a7d138f8745ac21de19c13d0f2d276a9a2eb10"
    },
    {
      "path": ".agents/plugins/distribution-identity.json",
      "sha256": "1f7b65cab337a55d0f993133ec9d9eb5aa065dbd364ab36701d308a2fc74eaae"
    },
    {
      "path": ".agents/plugins/install-manifest.json",
      "sha256": "34679e3978dcaa68aa9918713cee9a64347e6b7d8fe9f2be5ff10c4a38ede9c2"
    },
    {
      "path": ".agents/plugins/marketplace.json",
      "sha256": "9eba75feade121d0af69679e7f59e1fa38215a30bc2a7916b1b0b4a457d5c2f1"
    },
    {
      "path": "VERSION",
      "sha256": "1575e1af4a95f12f70b4ee6a6adce8160953d93ea17dc2611b90883ccc3ad3b8"
    },
    {
      "path": "agents/global-instructions.md",
      "sha256": "ab324755b8a8c7f422c904b3ee445a63f897d866f1695faada5f9f5c0259c16f"
    },
    {
      "path": "agents/operating-principles.md",
      "sha256": "ebc06bc778fcf9745b3307ed2c2126453d337edcbbc3a796c1f89faae694562c"
    },
    {
      "path": "plugins/maintenance/.codex-plugin/plugin.json",
      "sha256": "7e2db99c9b1dd5d29caf0ff2c0eb9f24e9ef98bdac18dffc92129f7297bd6630"
    },
    {
      "path": "plugins/maintenance/.codex-plugin/skill-watcher.json",
      "sha256": "21f7b31888fad4a15fc61f946b98084accf79390f1c397027c45674ed212418b"
    },
    {
      "path": "plugins/maintenance/README.md",
      "sha256": "82ecb46e9fb98da2dfdc0bae11fd630a107435524330f9da747de7046c0dfe79"
    },
    {
      "path": "plugins/maintenance/skills/doc-alignment/SKILL.md",
      "sha256": "25e7c15d49c8336dab3568b04ee8e38315d12f0da85009f9921e6638d8090bc9"
    },
    {
      "path": "plugins/maintenance/skills/doc-alignment/agents/openai.yaml",
      "sha256": "cc7b239b9b841745a56c7dd2d228df4e544f35bb26efc2a544face5639cb9187"
    },
    {
      "path": "plugins/maintenance/skills/doc-alignment/references/alignment-reference.md",
      "sha256": "851247015ba96fd6f8f81efa2dc879df9c9e33cf9f7079eb7f612fc5d42be6fc"
    },
    {
      "path": "plugins/maintenance/skills/doc-alignment/references/watcher-audit.md",
      "sha256": "5aa635be18771496d28d80076002357253279ba966f7d581ba4e2a1f0c76578c"
    },
    {
      "path": "plugins/maintenance/skills/doc-alignment/scripts/check_planning_tree.py",
      "sha256": "7175190253651020101df0b7d46ad8dbe0783c4e4ed8729b1897b52dbeeef030"
    },
    {
      "path": "plugins/maintenance/skills/housekeeping/SKILL.md",
      "sha256": "84431d64bb08cf8f01ca51cad651a310a6699e10a0d9de7089b17d4dc10e7dd4"
    },
    {
      "path": "plugins/maintenance/skills/housekeeping/agents/openai.yaml",
      "sha256": "04d1af7f6de6e5cb70d11444e81659360d5368b327a8ce02cc6727427493536d"
    },
    {
      "path": "plugins/maintenance/skills/skill-compressor/SKILL.md",
      "sha256": "bc31b4d4760989247f1f70dadf00fa5cbc1b44bdc61472293fe8961a2c4fb36d"
    },
    {
      "path": "plugins/maintenance/skills/skill-compressor/agents/openai.yaml",
      "sha256": "25391bf07e7c2726ced48369f62f3bede3b65ccdee76655154d10d6360345db0"
    },
    {
      "path": "plugins/maintenance/skills/skill-maintainer/SKILL.md",
      "sha256": "5ff3207e560b637341d8be79ee4281b2dc5f573b33a5660530ab938d7df691a3"
    },
    {
      "path": "plugins/maintenance/skills/skill-maintainer/agents/openai.yaml",
      "sha256": "197a1dd95b4d5157d564f6dae2bfbea531f07a9eca1ed40758c4537a2373fc4c"
    },
    {
      "path": "plugins/maintenance/skills/skill-maintainer/references/log-schema.md",
      "sha256": "3f458ef4ea2dd4980ac8971fe86565e171e3e4dc7869f91cabaaa2f6a39cacbd"
    },
    {
      "path": "plugins/maintenance/tests/test_doc_alignment_disclosure.py",
      "sha256": "354e4ebf7faec972f9584c5759b79ed28ac9afe9605e86fc380edd8d9f2116e7"
    },
    {
      "path": "plugins/mattpocock-skills/.codex-plugin/plugin.json",
      "sha256": "e82c0382cc316906743fcd4a5e17c0422eb4a02f45744414171e78b510827c42"
    },
    {
      "path": "plugins/mattpocock-skills/.codex-plugin/skill-watcher.json",
      "sha256": "57ec02b53b1f89710ecf419c9aacb8823d7a37ff5f1808023746f42b434fe945"
    },
    {
      "path": "plugins/mattpocock-skills/AGENTS.md",
      "sha256": "78c237b99c857151d1c82b9e33f9fcbc6ebff6c8bd3314fa7fe17ba604e147a4"
    },
    {
      "path": "plugins/mattpocock-skills/LICENSE",
      "sha256": "0e7ac423bf2c6e223b7c5b156f8cf72da49d748e56a1641402c31f22ad07dbb5"
    },
    {
      "path": "plugins/mattpocock-skills/README.md",
      "sha256": "1068f9c600b83d58581bf06f3f93bde310abd5c1e0cf1fa963dd5bd1fd7f5e8d"
    },
    {
      "path": "plugins/mattpocock-skills/skills/ask-matt/SKILL.md",
      "sha256": "aeb97c05cb5864681b5bb0df7e3b5364867e587aaf873ebb84ec6797e1466e2a"
    },
    {
      "path": "plugins/mattpocock-skills/skills/ask-matt/agents/openai.yaml",
      "sha256": "bdffbc5a0a99ed1b6ef3253d251d755fd18162b9845972e380007f844b09b05c"
    },
    {
      "path": "plugins/mattpocock-skills/skills/code-review/SKILL.md",
      "sha256": "45cfbe7b63121ec7a9eca7d89818a7c602592a3afc66ea4598ede40fbef23301"
    },
    {
      "path": "plugins/mattpocock-skills/skills/code-review/agents/openai.yaml",
      "sha256": "8229ca854e11dc8e6aef2131ee03f31fb1561cf905fab9ccc325180cf3331352"
    },
    {
      "path": "plugins/mattpocock-skills/skills/codebase-design/DEEPENING.md",
      "sha256": "cf1ad16cf1ddfda382d121f4f1be6537d3b76706b5f18ec3280745be33416e20"
    },
    {
      "path": "plugins/mattpocock-skills/skills/codebase-design/DESIGN-IT-TWICE.md",
      "sha256": "819ee82b84516a45ba09a911e70b22474cbad73d313b67b6a0bb394c9f95f935"
    },
    {
      "path": "plugins/mattpocock-skills/skills/codebase-design/SKILL.md",
      "sha256": "d12bfc7a7ccd1775194f409c36a809b38f9b7e766c3ed63dae81c687d85dbd55"
    },
    {
      "path": "plugins/mattpocock-skills/skills/codebase-design/agents/openai.yaml",
      "sha256": "edebc9e4fcfe102114012575eaa9600b9b5fd08c311664f389c36e7bc717740f"
    },
    {
      "path": "plugins/mattpocock-skills/skills/diagnosing-bugs/SKILL.md",
      "sha256": "bbf07ffc17abf86c3320dec9969a4218f5ab9cbe704a24070cbbe2a05f8b8809"
    },
    {
      "path": "plugins/mattpocock-skills/skills/diagnosing-bugs/agents/openai.yaml",
      "sha256": "3e430dbe4334a87597488c060cb3dc3786bb00c9182877d6f5ec41f62490e90b"
    },
    {
      "path": "plugins/mattpocock-skills/skills/diagnosing-bugs/scripts/hitl-loop.template.sh",
      "sha256": "18ae07e1cc49b32c71767e241a6e8de4be74ef21d5e3b7e39034d9c7335f2d80"
    },
    {
      "path": "plugins/mattpocock-skills/skills/domain-modeling/ADR-FORMAT.md",
      "sha256": "81eee7201b1116a3ec1a210e162aee67b39dad742bf39cf0aefc4255c0ae4f16"
    },
    {
      "path": "plugins/mattpocock-skills/skills/domain-modeling/GLOSSARY-FORMAT.md",
      "sha256": "b47d17fe4d66416d8ae54b43a123a72ca28f59e3616a08b22567774db45e88ed"
    },
    {
      "path": "plugins/mattpocock-skills/skills/domain-modeling/SKILL.md",
      "sha256": "8761616b035fd5ef1fb2de7cf48f9f587d113349ebd1962f1db5bf8cabbbc574"
    },
    {
      "path": "plugins/mattpocock-skills/skills/domain-modeling/agents/openai.yaml",
      "sha256": "f6bf2aa996c6e6f53fdd0708e18a0d16a56aed8322cca59fedbe3c0d2c75f06b"
    },
    {
      "path": "plugins/mattpocock-skills/skills/grill-me/SKILL.md",
      "sha256": "be7cc6075f3855c8a05d61dbfc116fe3dd5c90abe236319396e3dfb8063b0fd1"
    },
    {
      "path": "plugins/mattpocock-skills/skills/grill-me/agents/openai.yaml",
      "sha256": "c061e39c3e0f9d865fb1b97556d485704af2a8a58f4b8221a8917a5c2074a32b"
    },
    {
      "path": "plugins/mattpocock-skills/skills/grill-with-docs/SKILL.md",
      "sha256": "929a3a77d2f8ad53fad36f08616f117a0158fe131f9918f10c83c7bf9d8537c3"
    },
    {
      "path": "plugins/mattpocock-skills/skills/grill-with-docs/agents/openai.yaml",
      "sha256": "94cd0ab161fb468a836349f5ed482ba58ce8e709a05c57ce533d739dbd35cca9"
    },
    {
      "path": "plugins/mattpocock-skills/skills/grilling/SKILL.md",
      "sha256": "7e98ada3f0692230f5407dfa3ed283e137ada7588b52bd9d0603c6aada035a95"
    },
    {
      "path": "plugins/mattpocock-skills/skills/grilling/agents/openai.yaml",
      "sha256": "1411d7df7d99b7e621a1ff8283c8133cc2464be63d064e52d8ce169c6800ee9b"
    },
    {
      "path": "plugins/mattpocock-skills/skills/handoff/SKILL.md",
      "sha256": "f10af4362b4286b22f19e452bea1224a9fe24be95b0ed7ee0192678fc832e2cf"
    },
    {
      "path": "plugins/mattpocock-skills/skills/handoff/agents/openai.yaml",
      "sha256": "5c479fd562c691851690e8b18c8501045bef0943c10743d636b2fae26add1d28"
    },
    {
      "path": "plugins/mattpocock-skills/skills/implement/SKILL.md",
      "sha256": "00ddc5887a3c9c283eacb96b7bcdaabaf2069fe56a22b26bda1de37e05bce69d"
    },
    {
      "path": "plugins/mattpocock-skills/skills/implement/agents/openai.yaml",
      "sha256": "8970a8596ade0c28ab427f41a4ea242d6bdf6186c59ebf55e1238dbecaab79dc"
    },
    {
      "path": "plugins/mattpocock-skills/skills/improve-codebase-architecture/HTML-REPORT.md",
      "sha256": "c5346be318802bb6654b51fc1f60d6819459c50206659c7ff5d22664b8f75c72"
    },
    {
      "path": "plugins/mattpocock-skills/skills/improve-codebase-architecture/SKILL.md",
      "sha256": "62352c79e3b7a2658c20aee81e838c72847a451ad3c214067611d5bd7111f18f"
    },
    {
      "path": "plugins/mattpocock-skills/skills/improve-codebase-architecture/agents/openai.yaml",